<?xml version="1.0" encoding="UTF-8"?>

<!ELEMENT unit (animation*)>
<!ELEMENT animation (image*)>
<!ELEMENT image (#PCDATA)>
<!ATTLIST image delay CDATA #REQUIRED>
